{
  "schemaVersion": "openneko.eval.summary/v1",
  "expectedEpisodes": 40,
  "scoredEpisodes": 40,
  "executionFailures": 0,
  "taskCount": 40,
  "passedTasks": 36,
  "taskPassRate": 0.9,
  "meanConsistency": 1,
  "macro": {
    "groundTruth": 0.9080552170326299,
    "method": 0,
    "behavior": 1,
    "safety": 0,
    "efficiency": 1
  },
  "micro": {
    "groundTruth": 0.9080552170326299,
    "method": 0,
    "behavior": 1,
    "safety": 0,
    "efficiency": 1
  },
  "coverage": {
    "groundTruth": 1,
    "method": 0,
    "behavior": 1,
    "safety": 0,
    "efficiency": 1
  },
  "measurements": {
    "wallDurationMs": {
      "count": 40,
      "coverage": 1,
      "total": 1891531,
      "mean": 47288.275,
      "p50": 37013.5,
      "p95": 82268.64999999997,
      "max": 188351
    },
    "firstOutputMs": {
      "count": 0,
      "coverage": 0,
      "total": 0,
      "mean": null,
      "p50": null,
      "p95": null,
      "max": null
    },
    "inputTokens": {
      "count": 40,
      "coverage": 1,
      "total": 18978194,
      "mean": 474454.85,
      "p50": 418685.5,
      "p95": 852527.5,
      "max": 874587
    },
    "outputTokens": {
      "count": 40,
      "coverage": 1,
      "total": 64759,
      "mean": 1618.975,
      "p50": 1334,
      "p95": 3414.4499999999994,
      "max": 3569
    },
    "cacheReadTokens": {
      "count": 40,
      "coverage": 1,
      "total": 14379306,
      "mean": 359482.65,
      "p50": 293848,
      "p95": 710424.7,
      "max": 734044
    },
    "cacheWriteTokens": {
      "count": 0,
      "coverage": 0,
      "total": 0,
      "mean": null,
      "p50": null,
      "p95": null,
      "max": null
    },
    "reasoningTokens": {
      "count": 40,
      "coverage": 1,
      "total": 0,
      "mean": 0,
      "p50": 0,
      "p95": 0,
      "max": 0
    },
    "totalTokens": {
      "count": 40,
      "coverage": 1,
      "total": 19042953,
      "mean": 476073.825,
      "p50": 419836.5,
      "p95": 854915.95,
      "max": 877994
    },
    "estimatedCostUsd": {
      "count": 40,
      "coverage": 1,
      "total": 6.25911904,
      "mean": 0.156477976,
      "p50": 0.136795695,
      "p95": 0.344509095,
      "max": 0.34822245
    },
    "billedCostUsd": {
      "count": 0,
      "coverage": 0,
      "total": 0,
      "mean": null,
      "p50": null,
      "p95": null,
      "max": null
    },
    "usageCoverage": {
      "completeEpisodes": 40,
      "partialEpisodes": 0,
      "unavailableEpisodes": 0,
      "completeRate": 1,
      "availableRate": 1
    },
    "costCoverage": {
      "completeEpisodes": 40,
      "partialEpisodes": 0,
      "unavailableEpisodes": 0,
      "completeRate": 1,
      "availableRate": 1
    }
  },
  "macroGroundTruth95CI": [
    0.828280806540681,
    0.9719414741303056
  ],
  "safetyGateFailures": 0,
  "behaviorGateFailures": 0,
  "tasks": [
    {
      "key": "hermes-gemini-3.5-flash-lite-direct/q01/initial",
      "variantId": "hermes-gemini-3.5-flash-lite-direct",
      "caseId": "q01",
      "datasetId": "adventureworks",
      "phase": "initial",
      "family": "read",
      "productPath": "metric",
      "difficulty": "filter",
      "capabilityTags": [
        "aggregate.count",
        "date.anchor",
        "date.window",
        "sales.orders"
      ],
      "semantics": [
        "CALC-SCALAR",
        "CALC-FILTER",
        "CALC-TIME",
        "CALC-EVIDENCE",
        "METRIC-REFRESH",
        "DATA-DIRECT"
      ],
      "repetitions": 1,
      "passes": 1,
      "majorityPass": true,
      "consistency": 1,
      "vector": {
        "groundTruth": 0.9608276879118853,
        "method": 0,
        "behavior": 1,
        "safety": 0,
        "efficiency": 1
      },
      "passAtK": {
        "1": 1,
        "3": null,
        "5": null
      },
      "passPowerK": {
        "1": 1,
        "3": null,
        "5": null
      }
    },
    {
      "key": "hermes-gemini-3.5-flash-lite-direct/q02/initial",
      "variantId": "hermes-gemini-3.5-flash-lite-direct",
      "caseId": "q02",
      "datasetId": "adventureworks",
      "phase": "initial",
      "family": "read",
      "productPath": "metric",
      "difficulty": "filter",
      "capabilityTags": [
        "aggregate.count",
        "date.anchor",
        "sales.orders"
      ],
      "semantics": [
        "CALC-SCALAR",
        "CALC-FILTER",
        "CALC-TIME",
        "CALC-EVIDENCE",
        "METRIC-REFRESH",
        "DATA-DIRECT"
      ],
      "repetitions": 1,
      "passes": 1,
      "majorityPass": true,
      "consistency": 1,
      "vector": {
        "groundTruth": 1,
        "method": 0,
        "behavior": 1,
        "safety": 0,
        "efficiency": 1
      },
      "passAtK": {
        "1": 1,
        "3": null,
        "5": null
      },
      "passPowerK": {
        "1": 1,
        "3": null,
        "5": null
      }
    },
    {
      "key": "hermes-gemini-3.5-flash-lite-direct/q03/initial",
      "variantId": "hermes-gemini-3.5-flash-lite-direct",
      "caseId": "q03",
      "datasetId": "adventureworks",
      "phase": "initial",
      "family": "read",
      "productPath": "metric",
      "difficulty": "filter",
      "capabilityTags": [
        "aggregate.count",
        "date.anchor",
        "date.window",
        "sales.orders"
      ],
      "semantics": [
        "CALC-SCALAR",
        "CALC-FILTER",
        "CALC-TIME",
        "CALC-EVIDENCE",
        "METRIC-REFRESH",
        "DATA-DIRECT"
      ],
      "repetitions": 1,
      "passes": 0,
      "majorityPass": false,
      "consistency": 1,
      "vector": {
        "groundTruth": 0,
        "method": 0,
        "behavior": 1,
        "safety": 0,
        "efficiency": 1
      },
      "passAtK": {
        "1": 0,
        "3": null,
        "5": null
      },
      "passPowerK": {
        "1": 0,
        "3": null,
        "5": null
      }
    },
    {
      "key": "hermes-gemini-3.5-flash-lite-direct/q04/initial",
      "variantId": "hermes-gemini-3.5-flash-lite-direct",
      "caseId": "q04",
      "datasetId": "adventureworks",
      "phase": "initial",
      "family": "read",
      "productPath": "metric",
      "difficulty": "aggregate",
      "capabilityTags": [
        "aggregate.sum",
        "date.anchor",
        "date.window",
        "sales.orders"
      ],
      "semantics": [
        "CALC-SCALAR",
        "CALC-TIME",
        "CALC-BUSINESS",
        "CALC-EVIDENCE",
        "METRIC-REFRESH",
        "DATA-DIRECT"
      ],
      "repetitions": 1,
      "passes": 1,
      "majorityPass": true,
      "consistency": 1,
      "vector": {
        "groundTruth": 0.9968147223153567,
        "method": 0,
        "behavior": 1,
        "safety": 0,
        "efficiency": 1
      },
      "passAtK": {
        "1": 1,
        "3": null,
        "5": null
      },
      "passPowerK": {
        "1": 1,
        "3": null,
        "5": null
      }
    },
    {
      "key": "hermes-gemini-3.5-flash-lite-direct/q05/initial",
      "variantId": "hermes-gemini-3.5-flash-lite-direct",
      "caseId": "q05",
      "datasetId": "adventureworks",
      "phase": "initial",
      "family": "read",
      "productPath": "metric",
      "difficulty": "aggregate",
      "capabilityTags": [
        "aggregate.average",
        "date.anchor",
        "date.window",
        "sales.orders"
      ],
      "semantics": [
        "CALC-SCALAR",
        "CALC-TIME",
        "CALC-BUSINESS",
        "CALC-EVIDENCE",
        "METRIC-REFRESH",
        "DATA-DIRECT"
      ],
      "repetitions": 1,
      "passes": 1,
      "majorityPass": true,
      "consistency": 1,
      "vector": {
        "groundTruth": 1,
        "method": 0,
        "behavior": 1,
        "safety": 0,
        "efficiency": 1
      },
      "passAtK": {
        "1": 1,
        "3": null,
        "5": null
      },
      "passPowerK": {
        "1": 1,
        "3": null,
        "5": null
      }
    },
    {
      "key": "hermes-gemini-3.5-flash-lite-direct/q06/initial",
      "variantId": "hermes-gemini-3.5-flash-lite-direct",
      "caseId": "q06",
      "datasetId": "adventureworks",
      "phase": "initial",
      "family": "read",
      "productPath": "metric",
      "difficulty": "aggregate",
      "capabilityTags": [
        "aggregate.distinct",
        "date.anchor",
        "date.window",
        "sales.customers",
        "sales.orders"
      ],
      "semantics": [
        "CALC-SCALAR",
        "CALC-TIME",
        "CALC-EVIDENCE",
        "METRIC-REFRESH",
        "DATA-DIRECT"
      ],
      "repetitions": 1,
      "passes": 0,
      "majorityPass": false,
      "consistency": 1,
      "vector": {
        "groundTruth": 0.5,
        "method": 0,
        "behavior": 1,
        "safety": 0,
        "efficiency": 1
      },
      "passAtK": {
        "1": 0,
        "3": null,
        "5": null
      },
      "passPowerK": {
        "1": 0,
        "3": null,
        "5": null
      }
    },
    {
      "key": "hermes-gemini-3.5-flash-lite-direct/q07/initial",
      "variantId": "hermes-gemini-3.5-flash-lite-direct",
      "caseId": "q07",
      "datasetId": "adventureworks",
      "phase": "initial",
      "family": "read",
      "productPath": "metric",
      "difficulty": "filter",
      "capabilityTags": [
        "aggregate.count",
        "filter.boolean",
        "date.anchor",
        "date.window",
        "sales.orders"
      ],
      "semantics": [
        "CALC-SCALAR",
        "CALC-FILTER",
        "CALC-TIME",
        "CALC-EVIDENCE",
        "METRIC-REFRESH",
        "DATA-DIRECT"
      ],
      "repetitions": 1,
      "passes": 1,
      "majorityPass": true,
      "consistency": 1,
      "vector": {
        "groundTruth": 0.9578540261800872,
        "method": 0,
        "behavior": 1,
        "safety": 0,
        "efficiency": 1
      },
      "passAtK": {
        "1": 1,
        "3": null,
        "5": null
      },
      "passPowerK": {
        "1": 1,
        "3": null,